id,author_name,last_updated,rating,version,title,content,intention,classified intention
4257666089,AntagonistAlligator,2025-07-03T06:54:55-07:00,1,21.0.2,Extremely dysfunctional,I have never left a review before but the Verizon website and app are incredibly unusable. Many basic and essential functions don’t work. It’s almost impressive how little of this app is functional.,Negative feedback about usability.,technical/platform issues
4257469078,az_dragon_79,2025-07-03T05:59:52-07:00,3,21.0.2,Too much,"App has too much going on in it and is a little chaotic. Also, there is a permanent notification marker on it since the update.",Wants app simplified.,General Feedback
140945939,seannyjoffster,2025-08-16T21:29:49-07:00,1,21.1.1,Jumping the Verizon Ship,"After over 10 years with Verizon and not much to show about it except a high monthly mobile bill, it’s time to put Verizon behind me. I’m almost 64 and Verizon has no separate plan for seniors. V has taken my money long enough and doesn’t care about its customers, which I’m sure most of my fellow customers would agree.","Switching providers, dissatisfied.",Customer Support
140105193,dolfdog,2025-08-16T15:48:42-07:00,1,21.1.1,Slow payment systems,Verizon Systems are 10 years behind your competitors.,Criticism of payment system,Account & Billing
139927936,GritCityMitty,2025-08-16T14:36:55-07:00,1,21.1.1,Deals not truely given out,"Every perk somehow I’m ineligible for, every discount is blocked somehow, nothing of value is gained.. just stay prepaid and stay away from Verizon. Not worth it.",Negative experience with Verizon.,General Feedback
139270479,Roni chy,2025-08-16T10:49:35-07:00,3,21.1.1,Best,I’m satisfied,Customer is satisfied.,General Feedback
137872026,TDC0430,2025-08-16T03:55:24-07:00,1,21.1.1,Cluttered junk—- zero stars. Clown show developers. App is useless!! Hands down worse carrier app!,"Face id failes to launch update after update.  Read most recent reviews and don’t let fake apple algorithms fool you.  This app is flawed in every aspect.  FACEID BROKEN.  App crashes.  The app constantly logs you out, has a cluttered user interface, and a lame home internet interface that errors out every click with gimmick features. The scrolling tiles displays disorganized functionality.  Can’t tell if on app or internet due to app performing most basic of task on internet.  Might as well use internet vice app. Overseas sourced out customer service is sub par.  Will not recommend nothing from Verizon.  Verizon completely managed to f up an supposedly simple, seemless process.  My account has me enrolled in numerous Apple perks, yet Apple doesn’t recognize one subscription.  Total disaster of app and sourced out overseas support for issues",Expressing extreme dissatisfaction,Customer Support
137208839,JorgeD333,2025-08-15T23:34:13-07:00,1,21.1.1,Scammers,They purposely make cancelling services complicated and lie. I called to cancel a service and they told me it was cancelled only to find out it thru the app that it wasnt. Then i cancelled thru the app which I had to navigate and find where to cancel like it was hidden. They also try to trick you not to cancel by writing the cancel button in small print. Trash company overchargers for services. Now that i canceled my service on one phone i cant access the account for my other phone. This company makes it very very difficult on purpose please avoid Verizon at all cost trust me your saving yourself a headache,Cancel service difficult,Customer Support
137097005,Coyotes2,2025-08-15T22:46:20-07:00,5,21.1.1,Apps,Great,Positive feedback,General Feedback
136416988,dirks21,2025-08-15T18:10:37-07:00,2,21.1.1,How is this app a 4.7?,Am I the only one that finds this app really clunky and not user friendly? I feel like trying to do anything remotely productive in this app from buying a new phone to solving issues on my account is virtually impossible in the app. Maybe it’s on purpose so I have to call the 800 number and waste 2 hours of my life to submit a support ticket that is unable to be found when I call to check the status of it a week later. I’ve been with Verizon for 10+ years and the cellular service is fine but shame on you if you go to a Verizon store that is not a home office store. Why are these stores a thing if turning in a trade in there means the device is lost and I owe $1300? I lost 4 hours of my life just to not resolve the issue; the least I can do is leave a review questioning why the app is rated so highly when it feels like it was made in the 90’s on dial up internet while your big brother is trying to call his highschool sweetheart after your parents went to bed because he just hit puberty.,Negative app experience.,technical/platform issues
135840875,Feelee 56,2025-08-15T14:26:25-07:00,5,21.1.1,Great phone,Love my phone!!,Positive feedback,General Feedback
134770890,Heyshar,2025-08-15T08:42:25-07:00,1,21.1.1,Latest update,"I do not care for  the new format. Way too busy !
Too much!!! … you should have stuck to the previous format.",Dislikes new format.,General Feedback
134509225,Redzz June 14 2025,2025-08-15T07:31:39-07:00,1,21.1.1,Interesting,"How can I be writing a review when I did not order this, yet there’s a name underneath it . Thus hacked thru here?",Review not ordered,General Feedback
134195561,Brown 41,2025-08-15T06:07:02-07:00,2,21.1.1,Update,It’s not updating.. I travel for work and need the app to pay my bill,App update needed,technical/platform issues
134168451,Nismofosho,2025-08-15T05:59:35-07:00,2,21.1.1,Terrible app,Always issues can never get anything accomplished.,Expresses dissatisfaction.,General Feedback
133985245,one day this will work,2025-08-15T05:07:03-07:00,1,21.1.1,Update,It will not update for me at all!,Wants app update,Technical/platform issues
132618544,Mailhe,2025-08-14T20:36:04-07:00,1,21.1.1,Review,The app takes forever to load the billing portion of the app. Everything else works fine.,Billing load issue,Account & Billing
131521754,Nosox,2025-08-14T13:44:28-07:00,1,21.1.1,Hard as possible to buy new phones,I just want to buy new phone in store but have to go through so many hoops on the phone and online,Wants to buy phone.,Customer Support
130946647,Cluedo Man,2025-08-14T10:35:33-07:00,1,21.1.1,Prepaid customers,"Prepaid customers get treated very badly by Verizon wireless there is no customer service and Verizon features that require extra fees are locked out from prepaid customers so if you wanna go after Verizon, go after them through Google maps you can leave your voice there and speak your mind about how badly Verizon treats people and also how badly they lie about their coverage maps. Oh yeah, just for your information. Be careful. Apple is now releasing your real identity information to the app developers and can contact you and threaten you.",Complaint about Verizon,General Feedback
130670305,mjm.00,2025-08-14T09:14:53-07:00,1,21.1.1,Spam,"“Verizon: Hi Michael, great news! Upgrade and get iPhone 16 Pro on us (up to $1000 in value). When you trade in any phone on your account from Apple, Samsung or Google, any condition guaranteed.“

“iPhone 16 Pro. Get it on us”",Customer upgrade offer.,Customer Support
130403131,TreborSteep,2025-08-14T08:02:18-07:00,1,21.1.1,4.7 Stars ?,This app cannot get any worse..can it ?,Negative user experience,General Feedback
130028981,Batoloko503,2025-08-14T06:23:26-07:00,5,21.1.1,Convenience at your fingertips,The apps is very user friendly and if there is something you are having problems with it will automatically set you up with a representative to help you.,"Positive experience, helpful support.",Customer Support
129822049,Nite2727art,2025-08-14T05:26:14-07:00,1,21.1.1,Terrible app. Poorly managed. Tons of errors. They don’t even care.,"Auto pay is a joke. Logging into the app is a joke. Worse app to log into and they fight you on signing in. The developers made it for white people, black people get a harder time in the app just because they code it that way. Typical world. Auto pay is allowed for one card but the same card can’t use auto pay for both mobile and home? Only one? Thats by design. Whites don’t have that problem. People who have jobs like this still aren’t happy. Look at the coding it screams pain.  This isn’t a happy company it’s a company taking out frustration on the customer. Logging into social media is easier than this. I’m mixed so treat me like you treat the whites and stop blocking me from doing basic actions. No $10 dollars off for blacks.",App/Service Issues,technical/platform issues
129707054,Dkmwt,2025-08-14T04:53:03-07:00,1,21.1.1,No clear option to login as another account.,Verizon knows better. Why would I want to login into my family account using a primary phone number? Not an option in this app to easily login as another phone number to manage main account.,Login option needed,technical/platform issues
129624791,eventedbetter,2025-08-14T04:28:20-07:00,1,21.1.1,Business bill pay non-functional,"When attempting to pay my business bill in this app, I am redirected to residential Bill pay, and I cannot make a payment.",Cannot pay bill,Account & Billing
128628921,OtterLvr209,2025-08-13T22:19:52-07:00,5,21.1.1,Personal check,"There was no mention of paying my phone bill with a personal check.
That service was afforded to me when I used the machine in the Verizon store.
Currently, I am not using my credit cards nor my ATM card because of fraudulent activity.
I am using my personal checking to handle financial matters.

Teresa Azcarate",Pay bill with check.,Account & Billing
127908004,Yurfavdarkskin,2025-08-13T17:33:56-07:00,5,21.1.1,Verizon is amazing,I’ve been loving Verizon for the time being that I have been with them very helpful and convenient,Customer is satisfied.,General Feedback
127711816,ひつじ　ロリタ,2025-08-13T16:17:07-07:00,1,21.1.1,Bad service all over,"Calling any verizon number puts me in a phone loop. Trying to talk to someone, I get hung up on by the system.  It took me a long time of trying anything and everything because my account wasn’t fully set up by the representative to get to another person to talk to, who was someone overseas, that asked me to send them copies of my proof of residence and I.D., as well as asking for all the addresses over and over.  The person that initially set up my account misspelled my name despite me telling it to her and spelling it multiple times, and then I was told that they could not update it, because the account was not finalized. So I was getting flagged for things not being correct, and could not get my phone sent to me. Since I moved, and my state updates address changes in the system, and I don’t have a new I.D., I don’t even have one to take a picture of to send, even if I wanted to. So they won’t ship my phone, and are just sitting on the SIM cards as well, despite me providing them all of the detailed information they were asking for, but it wasn’t enough for them. Trying to get to talk to a helpful person from here doesn’t work. Terrible service and fail app where you can’t even update the incorrect information that they built in when setting up the account in the system. (Not profile name. I mean the account that the person set up incorrectly.) Awful system and terrible customer service.",Complaint about service,Customer Support
127660763,JMWPol,2025-08-13T15:56:46-07:00,1,21.1.1,Glitchy App,"The app always forces me to reset my password; since last year I’ve been forced to create a new password every month. Also with the app updates, I notice the app never works seamlessly even after an update.",App functionality issues.,technical/platform issues
127258483,Trnyii,2025-08-13T13:25:19-07:00,1,21.1.1,iPhone and iPad TRILLIONS 👎🏻,"LOYAL CUSTOMER FROM 2009 till now WHY? NEVER MISSED PAYMENTS AS (POST CUSTOMER 4yrs) and now PREPAID EVER SINCE NEVER MISSING PAYMENTS EITHER
AND STILL DEVELOPERS ARE STILL FAILING OMG SERIOUSLY 😡😡😡😡😡😡😡😡😡😡😡😡😡😡😡😡😡😤


App versions 20.6.1,20.7.0,20.7.1 and the most recent 20.80 FAILED TO FIX
USAGE (MINUTES) DETAILS STILL WHY!

I STILL SEE THIS WHEN I LOOK USAGE SECTION DETAILS FOR MINUTES

“We Can’t Process Your  Request Right Now,
Sorry about that, Please try again later.
               Retry


That’s the message from since January 2025 still TRILLIONS 👎😤😡

                UPDATE
Omg now 4/17/25  now data is not giving details!

Another Update 20.9.0 equates to a USELESS ATTEMPT FROM DEVELOPERS plus they change the dates of APP VERSION UPDATES!

REMOVING AGAIN MAYBE NEXT YEAR I WILL TRY THIS APP BUT FOR NOW I AM NEVER EVER RECOMMENDING!

20.9.1 SMH (USAGE) DATA and MINUTES still not available after FIVE app update OMG THIS IS THE UTMOST WORST FUNCTIONALITIES EVER AS A LOYAL CUSTOMER 🔊2009 and current and I DEFINITELY WILL NOT RECOMMEND TO OTHERS DEVELOPERS AREN’T CAPABLE ANYMORE!!!😡😡😡😡😡😡😤😤😤😤

Today is the 2nd June 2025 this 20.9.1 version from 4/17/2025 something is definitely wrong with their DATES!

3rd June 21.0.0 SIX HOURS AGO AND IT DID NOT FIX ANYTHING ( minutes and data)🔊 USAGE 😡STILL SHOW THAT ANNOYING STATEMENT THAT IS MENTIONED IN THIS REVIEW DEVELOPERS WHAT IS THE PROBLEM AFTER SO MANY VERSIONS AND MY DEVICE SOFTWARE IS UP TO DATE 18.5 iOS!

Update
VERSION  FLOPPED AGAIN
🔊21.0.0 five days ago STILL DID NOT FIX “USAGE”
Minutes and Data showed that PATHETIC MESSAGES

QUOTE TRY AGAIN LATER AKA 6 MONTHS THIS APP STILL DEFINITELY NOT WORKING!

There used to be a WIDGET AVAILABLE AND NOW CALLING THE AUTOMATED SYSTEM IS DO DAM ANNOYING SERIOUSLY THIS COMPANY IS AT ITS TRILLIONS WORST WHERE THIS APP IS CONCERNED
SINCE 2010 I HAVE BEEN using as PREPAID AFTER MY 2 YEARS contract expired with me never missing any payments I decided NOT TO RENEW (POST ACCOUNT!) the customer service center and store stressed me out and the worst customer service from both made my decision for PREPAID!

6/18/25
Usage MINUTES AND DATA STILL NO INFORMATION LIKE BEFORE DEVELOPERS WHAT’S going on LOYAL CUSTOMER MEANS NOTHING TO THIS BUSINESS!😡😡😡😡👎👎👎
Another Update 21.0.2 FAILED TO FIXED {USAGE SECTION} (Minutes) details still showing
That PATHETIC “WE CAN’T PROCESS YOUR REQUEST SORRY TRY AGAIN LATER” STILL SHOWING WHEN I SELECTED seriously the UTMOST WORST FROM DEVELOPERS EVER😡😡😡😡😡😤😤😤😤🤯


8/12/25
Usage details seems to work but the accuracy for MINUTES is a tad off for calls I made suppose to be green and there is a specific number I always call but that number cannot call me.

Touch ID
I signed in and closed got verified by Emil it is done QUESTION WHY DO I HAVE TO SIGN IN AGAIN EVERY TIME I USE CERTAIN SECTION’S that requires touch?

WIDGET IS GONE AND QUALITY IS STILL HORRIBLY LACKING!

8/13/2025
😡New Version (21.1.1)did NOT FIX TOUCH ID I did it THREE TIMES I AM DONE!",App functionality issues.,technical/platform issues
127120358,kn1983637,2025-08-13T12:37:40-07:00,1,21.1.1,Ads,App sends you advertisements as notifications. Not nice!,Dislikes ad notifications,General Feedback
127016172,1 Perfect Nelli,2025-08-13T12:02:59-07:00,1,21.1.1,I had no idea,"I had no idea this App was on my phone! I have no idea what it does or does not do! Therefore I guess it is of no use to me!
But I sure know Verizon has terrible connection to your towers! Honestly I regret switching to Verizon ! And now I am saddled paying for my free phones for several years. The in person staff is great but Verizon towers are often unavailable for use.",Regret switching to Verizon,General Feedback
126705199,specialistappreviewer,2025-08-13T10:24:16-07:00,5,21.1.1,Verizon,Add dark mode,Request dark mode.,General Feedback
124494641,Keiarra M,2025-08-12T22:03:33-07:00,5,21.1.1,Great work,I’ve been a Verizon customer all my life. Love em!,Customer satisfaction.,Customer Support
123326004,ExFitness,2025-08-12T14:09:53-07:00,5,21.1.0,Easy peasy,I like how easy the app is to navigate.,App navigation ease.,General Feedback
123022493,MRmaro,2025-08-12T12:19:58-07:00,1,21.1.0,Usage is impossible to extract,"I got a warning that I was running out of data. I have two lines, and the sum of the usage shown on them is much less than the total usage shown; I cannot seem to get accurate numbers that let me figure out what is going on. The app used to work—note it is mostly ads for more expensive plans.",Disputed data usage,Account & Billing
123016646,casar01,2025-08-12T12:17:57-07:00,5,21.1.0,Review,I love my Verizon but every month or so I end up having extra charges. I did not have Netflix on either phone. Please leave it off my cell phones. Service is great other than that. If we could get the senior cell phone bill that would be great. Thank you for serving us,Resolve extra charges,Account & Billing
122114060,Big_Lethal,2025-08-12T07:03:28-07:00,1,21.1.0,Terrible UI,"After the app ‘forgot’ my username, it autofilled the wrong user name and won’t let me put the right user name in and every time I try to login it automatically puts the wrong username and then says I’ve entered the wrong info. Now every time I try to login, it locks me out after trying to put the wrong info in over and over again without letting me change the user name. I deleted the auto fill from my phone, so I guess it’s just using a blank every time? Anyways I’d love to do anything on this thing but I can’t even talk to customer service rep without a login.",Login issue resolution,technical/platform issues
121944128,Casethe2,2025-08-12T06:15:18-07:00,5,21.1.0,Verizon App,Amazing,Positive feedback,General Feedback
120054292,astro.dave,2025-08-11T18:10:53-07:00,2,21.1.0,Call log doesn’t include time,"Also, the filter doesn’t update right away.

Also, why do we have to open the app to keep it updated?

It also limits the number of allowed calls if you set it for the most strict blocking.

I have been a Verizon customer for years, but having switched one line to T-Mobile, I think their service is better.",Switching to T-Mobile,Customer Support
119685656,Chrissypop36,2025-08-11T15:42:38-07:00,5,21.1.0,Easy and Convenient,"Easy to use, nice to not have make appointment at store.",Easy and convenient,General Feedback
119668121,Va care giver,2025-08-11T15:35:21-07:00,5,21.1.0,Call filter,"Life savor for sure, n","Positive, life-saving",General Feedback
119579741,Ejhdenver,2025-08-11T14:59:42-07:00,1,21.1.0,Buggy mess since revamp,"App is hot garbage now. It’s buggy and constantly indicates that it wants you to do or update something but doesn’t really tell you what; and if you do think you have found what it wants, and take action, it won’t remove the alert anyway.  Uninstalled",Uninstalling due to bugs,technical/platform issues
118074005,Jae.333,2025-08-11T06:53:35-07:00,5,21.1.0,Great,Been with Verizon for almost and if not 5 years now. They got great customer service. They do take a while to figure out who to send you to but once they do your problems will be solved.,"Satisfied customer, good service",General Feedback
117825802,Riri0923,2025-08-11T05:40:51-07:00,1,21.1.0,Never works right,"Anytime I try to use it, I just get error messages to why they can retrieve my information. Shows no past data on my bill and I’ve verified it’s all correct information. The app is pointless because I have to go through my computer to get my information to show up.",App not working,technical/platform issues
115810561,Best ever budget shopper,2025-08-10T16:17:21-07:00,5,21.1.0,Happy with service,Fast connection wide range and more connected devices . Affordable than most other service providers.,Customer satisfied with service,Customer Support
114521250,Madinov,2025-08-10T08:45:02-07:00,1,21.1.0,bastard connection,the connection is very often disconnected in north chicago!!!!!!!’,Connection issues,technical/platform issues
114019287,Architect NYC,2025-08-10T06:20:39-07:00,1,21.1.0,Worst TV System Ever – Avoid at All Costs,"This new Verizon Fios TV system is an absolute disaster. It NEVER works without a reboot. Every single time I want to watch something, I have to spend 15 minutes restarting the box, the app, or both. It’s like Verizon took something simple and reliable and replaced it with the most frustrating, broken system imaginable. The interface is clunky, slow, and unresponsive, and the constant errors make you want to throw the remote at the wall.

I’ve had cable for decades and have never experienced anything this bad. The amount of time wasted just to watch live TV or stream a channel is absurd. Verizon clearly rushed this out without testing it properly, and paying customers are now stuck dealing with their mess.

Do yourself a favor: NEVER get Verizon Fios TV.",Avoid Fios TV.,General Feedback
111388069,dcghgdfh,2025-08-09T12:57:03-07:00,5,21.1.0,Great service,Wonderful company to rebuild my life with after completely destroying it all. Very helpful and encouraging! Great value,Rebuilding life post-destruction,General Feedback
111099356,C.S. Fanciullo II,2025-08-09T11:14:44-07:00,5,21.1.0,Ole’GSD,"As a customer since 2001, VERIZON has always treated their customers fairly. There has been times of policy changes not communicated, business department not following through but Verizon as a whole is a tremendous co. To have cell service with.",Positive customer experience,General Feedback
110883671,FighterKaitlin,2025-08-09T10:05:18-07:00,1,21.1.0,Verizon app is glitching,I’m trying to access my service to pay my bill. Always a pop up error. Same for the website.,Wants to pay bill.,Account & Billing
110314477,Houzse,2025-08-09T07:19:13-07:00,1,21.1.0,Horrible app,"Nothing works in the app. Something as simple as a speed test sits and does nothing. I placed an order for less than I’m currently paying , the app confirmed it, and then the email shows it for a higher cost. And then the app is telling me my order can’t be processed. Which is it? Why so many inconsistencies?",Customer frustration/dissatisfaction,General Feedback
4256869181,criminal eye,2025-07-03T02:40:55-07:00,5,21.0.2,“Oh my goodness!“,"This app has made payment processing much easier, thanks",Payment processing simplified,General Feedback
4256638838,OhhEight,2025-07-03T01:08:48-07:00,4,21.0.2,New Costumer,I love everything… from bill amount to perks. But internet is slower than T mobile and more call fails,Mixed satisfaction,General Feedback
4256056516,HGPReview,2025-07-02T21:10:27-07:00,1,21.0.2,Terrible,"Terrible, deceptive, and irresponsible",Negative experience,General Feedback
4255734019,mden23,2025-07-02T19:08:08-07:00,1,21.0.2,Clear the notification badge!!!,"Recently there is a notification badge that cannot be cleared. I’ve force-killed the app, deleted it & reinstalled, all to no avail. Turn off the [}%^%} badge if there’s nothing for me to address!!! Incredibly annoying.",Clear notification badge.,technical/platform issues
4255568147,twwbond,2025-07-02T18:06:59-07:00,1,21.0.2,Bad for home 5G,App does not work for setting up 5G home internet.   We have equipment.  It says we haven’t received yet.   Can’t proceed with setup.   Very bad design.  Hour on phone with support was useless.,Difficulty setting up 5G,technical/platform issues
4254976572,QATester12345,2025-07-02T14:17:50-07:00,1,21.0.2,Worst app ever,"The app will constantly have log in multiple times within the app, ask your location constantly, so many pages wont load. It’s impossible to get help through chat assistant.

The website will directly link you to the app then the app will send you back to your browser, what the point??

Pages will constantly load i don’t understand why im back navigating to page that was already loaded???

The app is useless might as well just call and wait on hold so u can actually get help, then maybe theyll actually take the app seriously",Frustrated with app,technical/platform issues
4254607236,mimi poppa,2025-07-02T12:07:31-07:00,5,21.0.2,Helpful,App is so much better then in person can do a lot of stuff and order come in fast a lot faster and cheaper here and I can always solve my problem with a click of a button recommend using the app better,App is better,General Feedback
4254201471,Review2dayscrap,2025-07-02T09:58:46-07:00,4,21.0.2,50/50 choice,I will say the app works fine. But Verizon the company better get off their butts and make Verizon better cause they’re getting caught up with and even passed. T-Mobile is already better,Wants Verizon improved,General Feedback
4253799462,Julian .p,2025-07-02T08:03:26-07:00,5,21.0.2,You FINALLY got it RIGHT,To be a technology company you have had the WORST website and pay on line system. Today with the changes I couldn’t believe the difference. Thanks for making the necessary changes to earn the title “My Verizon”!,Improved website experience,General Feedback
4253743016,Emma345532,2025-07-02T07:47:44-07:00,1,21.0.2,Worst internet you can get,Don’t get scammed they offer fast internet at low prices THATS I LIEEE the internet is the slowest you can get different companies offer more G that ar lower prices THATS,Warning against internet.,General Feedback
4253706860,Jay A M,2025-07-02T07:37:41-07:00,5,21.0.2,Updated app,The app has updated making it faster and easier literally press away from paying my bill as before the loading would take longer and would sometimes redirect,Positive app update.,General Feedback
4253498916,sussely777,2025-07-02T06:40:03-07:00,4,21.0.2,Bad Experience with the Costumer Service,Love to use the app but when I call to fix my billing problem most of the time don’t got resolve and when I ask for supervisor they always say is no there . When I ask for support agent they said they can’t help you 😔,Customer service issues.,Customer Support
