id,author_name,last_updated,rating,version,title,content,intention,classified intention
4228154089,BrunnenKai,2025-06-25T21:42:50-07:00,1,21.0.2,Absolute gárbáge,"WiFi down at my mom’s house. Of course “customer service” appears to be getting this app. I download it. Try to set up account/put my mom’s email in. The app accepts it then I verify using a code they send to my mom’s phone. So far so good. But then later when I go to use her email as my login credentials, the App says the email isn’t valid??  This is The email they send a statement to every month. Also if I go to the regular site using a link in the monthly statement EMAIL THEY SENT MY MOM, I will get another “this isn’t a valid email”???  I try to set it up then using my own email. It takes me through setting up a password. I SCREENSHOT the password to make sure I don’t forget it. I choose a secret question and put in my answer. It takes me through the sign in process again. It asks the secret question. I answer. I put in the password that I had just created. It says the password isn’t correct??  Then it asks me the answer to a secret question that I had NOT selected and NOT answered??? I don’t bother answering this point. How is a company that can be considered a tech company such garbage with its tech?  I guess tomorrow I’ll try customer service on the phone and pray I can eventually talk with a (hopefully English speaking) representative.",Expressing extreme frustration,Customer Support
4227914350,yogithump95710,2025-06-25T19:59:39-07:00,1,21.0.2,Verizon Visa Dashboard Not Showing,"Prior to the update on June 24, 2025, we could click the “more” tab on the bottom right and then click “Verizon Visa Dashboard.” Now that option is no longer available. Why did you remove this Verizon? I can’t see my rewards at all even though I know Verizon Dollars are accumulating via the Verizon Visa app.",Restore dashboard access,technical/platform issues
4227410477,Corellean,2025-06-25T16:39:31-07:00,1,21.0.2,I don’t understand how this has 4.7 stars,"This app is terrible, it is beyond me how it has 4.7 stars. If you need support good luck. The “chat with us”, which says it is the fastest, does nothing. The chat via messenger opens messenger and then does nothing. The scheduled phone support calls me and then hangs up on me after telling me my balance - which is 0. This app and Verizon support in general are the worst I’ve ever encountered.",Customer unhappy with support,Customer Support
4227141373,AMCooks,2025-06-25T14:51:31-07:00,1,21.0.2,Over priced for no service,"Since Feb. my phone has been unable to send picture texts within the first attempt to send. My internet service has been trash, and half the time my phone calls are dropped. Paying almost $300 a month for???? Yet when I call they say there’s no service outage in my area. I’m so done, taking my business elsewhere.",Cancelling service.,Customer Support
4226920380,Barbj1692,2025-06-25T13:28:26-07:00,1,21.0.2,"Horrible worthless app, can’t sign in after upgrade","I tried to sign in for my internet accountand app wouldn’t recognize password. It send me numeric temp passwords, and none worked!!! It locked my account, and all I get are robots when I try to live chat!!!!!!!! My only option is to go to help page on X. You’re disgusting and worthless!!!!!",Can't access account.,technical/platform issues
4226893031,Spooky ooky ooky girl,2025-06-25T13:18:43-07:00,1,21.0.2,Service,Service goes out 76% of the day,Service outage concern,technical/platform issues
4226512148,M0stleyHarmless,2025-06-25T11:10:14-07:00,2,21.0.2,Deleting the app,"The app has started serving ads through notifications. I have used the app to contact customer support a few times, but anytime you switch to a different app while waiting for a response, it loses track of the conversation and forces you to log in again. This happens even when switching over for a few seconds.","Disappointed, deleting app",General Feedback
4226150928,Marty Veee,2025-06-25T09:17:49-07:00,5,21.0.2,Wow!,"Verizon just released my access which is a reward system where you can claim gift cards, concert tickets and more from inside the app. I’m not one to leave a review but Verizon deserves it.","Positive feedback, appreciation.",General Feedback
4225931977,drbn00,2025-06-25T08:13:25-07:00,1,21.0.2,Really terrible,"I don’t usually write reviews but this application truly inspired me to do so. It’s just one of the worst apps I’ve ever used. It takes about 40 seconds for any page to load and sometimes just doesn’t load at all with no error message. My internet service is good otherwise, but even if it wasn’t then that would be Verizon’s fault nonetheless. This is a real piece of garbage and I would be extremely embarrassed if I was involved in making this app. The way that this thing consistently doesn’t work at all reasonable pace is just so funny and disgusting",Expressing extreme dissatisfaction.,Customer Support
4225102921,The metal face,2025-06-25T03:58:23-07:00,5,21.0.2,As intended,the app works,App works as intended.,General Feedback
4223762926,Friendzz7,2025-06-24T18:20:10-07:00,5,21.0.2,Global sporting,Thank you for including discounts for world club cup.,Expressing gratitude for discounts,General Feedback
4223742935,Goren Ha Atad,2025-06-24T18:12:02-07:00,1,21.0.2,Terrible,The version of this app with the bright red banners and yellow text is just terrible. Every screen looks like a warning that your phone is about to die. It’s hard to find details about your devices. What a fail,Negative app experience,technical/platform issues
4223584746,lovierenee,2025-06-24T17:06:13-07:00,2,21.0.2,Added bogus charges,Every time I turn around Verizon added a new charge for something or Go up on a device or perk without informing the customers. This is not business,"Billing dispute, dissatisfaction",Account & Billing
4221916432,Tom McElvy,2025-06-24T07:29:54-07:00,1,21.0.2,Upgraded App is Horrible,"I opened the app today to get my bill.  What a convulated mess.  Looks like a government agency made this, as it is difficult to find anything.  I have Fios service only, not wireless, not phone, not tv.  Took 15 minutes to find the billing section, and the last two months bills are not there.  This is a joke.  Please brink back the previous version, so I can manage my Fios service.",Wants old app back,General Feedback
4221912261,ClassySassyBoss,2025-06-24T07:28:41-07:00,5,21.0.2,Super Convenient!,Easy to use and definitely quicker than calling in.  This has been one my preferred method when dealing with my account.,Finds it convenient,General Feedback
4221354808,Zweisenthal,2025-06-24T04:38:13-07:00,5,21.0.2,Excellent app,The recent updates to the Verizon app are 10/10. It is easy to navigate and provides all the information and tools I want to get info on and take action on my account. Almost no bugs. Well done.,Positive feedback on app,General Feedback
4221090716,edivfiehfidkcb,2025-06-24T03:00:27-07:00,1,21.0.2,Won’t let me swap my phone,"It lets me do it online, but not in the app. What’s the point?",App functionality issue,technical/platform issues
4219626014,Cloud NonStorage,2025-06-23T16:23:00-07:00,1,21.0.2,Cloud,Never trust this!!! They will delete your pictures and videos,Negative experience warning,General Feedback
4219386133,Satanasjr,2025-06-23T14:42:06-07:00,5,21.0.2,OG,"Best carrier, The service it great.","Positive, great service",Customer Support
4219337828,Maverickakshat,2025-06-23T14:22:35-07:00,1,21.0.2,Worst customer service ever!,There’s essentially no customer support available. You chat with an AI and if it can’t help you. You’re stuck. The app doesn’t function properly. It can’t follow troubleshooting steps and would bring back to home screen during troubleshooting. Worst customer service ever. I was annoyed at first but I’m just amazed by the entire experience. Discontinuing my services right now. You’re warned!,Discontinuing services due to poor customer service.,Customer Support
4219004303,Micuparamedic,2025-06-23T12:18:52-07:00,1,21.0.2,No title can cover how bad this is…,"First, the app itself is slow. There’s delays jumping from page to page. The layout may be intuitive if it actually worked. This would be an amazing app if any part actually worked. The speedtest works intermittently at best. Same for the router reset. Funny thing is, if it can do the speed test, it won’t let you reset the router! At least there’s an option for support. That should give you hope that Verizon is there and they care. Go ahead, click on the call back button. You may want to take an aspirin first. I’ve tried a total of 6 times. The first time, it gave me some hope. They called back immediately… and took me directly to automated purgatory. When asked for my pin, I went into the app to get it but the automated system just hung up. The next time I pressed the button for a callback, no callback after 15 minutes. I press the button again and I’m returned to robotic purgatory. This time I get past the pin. I’m asked if I’m calling about setting up my autopay. After replying no, the soul sucking system decided it wasn’t worth there time if it wasn’t about money so the automated demons hung up again… it took 6 times and eventually I just called myself. Then, 41 minutes later, someone actually came to the line. I can’t tell you yet if they’ve fixed my issue but that is irrelevant to the review of this application atrocity. Consider yourself warned, if you plan on using this application atrocity you may need a punching bag as well.",App and support frustration,Customer Support
4218801445,IraOrman,2025-06-23T11:09:34-07:00,5,21.0.2,Easy,The ease of shopping through the app make online purchases more convenient,App shopping convenience,General Feedback
4218513136,Ezgo3601,2025-06-23T09:35:05-07:00,2,21.0.2,Sign in process,Sign in process is far from no from from being “user friendly “.  Orders placed thru the Call Center frequently causes phone outages requires a trip to the Verizon store 20 miles away.,Frustrated with service,Customer Support
4216501605,DJM I,2025-06-22T20:45:25-07:00,1,21.0.2,Bill,Bill is too high,Complaint about bill,Account & Billing
4216247209,Egzachlee,2025-06-22T18:54:04-07:00,2,21.0.2,Face ID,Why can’t I log in with Face ID?????,Troubleshooting Face ID issue,technical/platform issues
4216214876,Ksenia RP,2025-06-22T18:40:23-07:00,1,21.0.2,Apple Music not active,"Spent 20 mins with customer expert at the store. No luck.
Spent 80 mins with tech expert over the phone no luck. My family has been with Verizon for over 10 years. We love the company but this perk of Apple Music is real trouble as it not working with Apple iPhone at this time.",Apple Music not working,technical/platform issues
4215897590,YURMOMMA29,2025-06-22T16:23:02-07:00,1,21.0.2,Terrible,Gets worse every time I use the app. Where are the parental controls now????!?!?!? All of a sudden the parental controls are nowhere to be found. I honestly hate this company.,Complaining about parental controls.,Technical/platform issues
4214396951,Cajcyvuejsvxtebd,2025-06-22T07:34:39-07:00,5,21.0.2,Amazing service in keeping humans connected,Thank you,Customer thanks for service.,Customer Support
4212942638,Jon f jerlihv,2025-06-21T22:18:38-07:00,1,21.0.2,This app is stupid,The keyboard don’t work on this stupid app,Keyboard not working,technical/platform issues
4212656239,nugx,2025-06-21T20:11:54-07:00,1,21.0.1,Dark UX,"Don’t make it so hard to cancel my Disney+ addon, you shady people.",Cancellation difficulty,Customer Support
4211121695,Savannah247,2025-06-21T10:03:04-07:00,1,21.0.1,Dnt like it,What is Russell? That’s. What I get when I search it,Dislikes search results,General Feedback
4210135939,tiger pole,2025-06-21T05:01:36-07:00,1,21.0.1,Filthy Thieves,"This company is the absolute worst. It’s never ending! I was told that I over paid a total of $700 and that it would be credited and never was. Hours & hours over years and years of long phone calls that result in nothing- no changes- no resolution etc. never resolved and never received a penny, instead it all happened again where I was charged $20-30 more each month… i was told my bill would now be $50 after 3 hours and they just deducted $75. I saw an email that said my bill was changed to $50 but when it came time for autopay they stole money that is not authorized. All this over the past 20 years. The workers are just as corrupt as whoever’s running this skummy company.","Negative, unauthorized charges",Account & Billing
4207819393,Kyla Kaufman,2025-06-20T13:19:57-07:00,1,21.0.1,Travel,The travel passes do not work.,Travel passes ineffective,Technical/platform issues
4207738888,Beaubeau61,2025-06-20T12:50:13-07:00,3,21.0.1,Not enough to keep me,There's no special perks that I use I don't get any free TV I don't get any free anything I rented a movie the other day cost me $20 and I'm paying $10 a month if so whatever it says $15 a month minus customer discount but it says I don't get anything free so why would I want to have Apple one,Disappointed by lack of perks,General Feedback
4204807219,Jzidhsj1,2025-06-19T18:47:08-07:00,1,21.0.1,Terrible app,"This is the most app on my phone. Not user friendly, not intuitive, and not helpful. Makes me want to switch phone services because it’s so awful.",Extremely dissatisfied customer.,Customer Support
4204723264,sundownbrm,2025-06-19T18:12:54-07:00,1,21.0.1,Unbelievable,"This is the worst internet app I’ve ever experienced. I can’t even reboot the router from my app, and it has all these “special security features” that I assume also don’t work because I can’t simply reboot the router from the app. Completely unacceptable from a company as big as Verizon.

Edit: still horrible. Basically doing any kind of task on this app is a nightmare. Insane that a company as big as Verizon makes their app so so so bad.",Expressing extreme dissatisfaction,Customer Support
4202552546,The Walker!!?!,2025-06-19T05:44:28-07:00,4,21.0.1,Verizon is AWESOME!!!!,"Dude, when I switched over to them, they hooked me up with soooo many tubular awesome new devices I can’t even believe it!! And a pretty affordable monthly plan that I’m locked into for 3 years, but I wouldn’t have it any other way!!!! You’re totally Awesome Verizon!!! Thanks for being so tubular! Thanks for helping me ride the wave of a lifetime!!! 👍👍✌️❗️❗️😂👉👉","Positive, highly satisfied.",General Feedback
4202129419,KassieME,2025-06-19T03:14:10-07:00,1,21.0.1,Glitchy one in all app,Ever since they switch to using one single app for cable/internet/wireless service the app is glitchy. Hard to use and not user friendly. Please fix,App needs fixing,technical/platform issues
4202060954,Ithicka,2025-06-19T02:45:33-07:00,1,21.0.1,I hate it I can’t wait to switch,The platform is very complicated. I have not been able to log in for MONTHS! I report this technical issue to customer service & NOTHING was resolved. I had AT&T for 4 hours & never experienced anything like this,Wants to switch providers.,Customer Support
4201076331,Derraculous,2025-06-18T19:23:11-07:00,3,21.0.1,Uhgh,"This is definitely one of the most glitchiest and slow apps I’ve encountered. It seems to take longer than needed to load pages, and when they load, it’s just awkward and glitchy.",Negative app experience,technical/platform issues
4200183588,Dee1953Dee,2025-06-18T13:24:29-07:00,5,21.0.0,My Verizon Phone,Love Verizon has everything I need,"Positive, satisfied with Verizon",General Feedback
4199503672,PrinceofWilton,2025-06-18T09:43:36-07:00,1,21.0.0,Slow,Service top dollar,Disappointed with service.,Customer Support
4198907278,Posterized,2025-06-18T06:50:25-07:00,2,21.0.0,Lackluster,"(Update)
1. Still lacking a widget, especially one that tacks data usage vs days left. I still don’t know why they got rid of this.

2. The Alapp is still a shell for their website. So the entire experience is slow, buggy with frequent crashes

3. The “My Data Usage” page has turned into a joke. They got rid of the bars/charts that lets you see each members data usage and the number of days left all in one view. You’re now forced to click on each member to see their usages. Worse, the data only shows the total data used not for each individual.


PLEASE!!! Do something about the app. Why does it get worse with each update?????

———————-
Biggest gripe is the widget not showing how many days are left for the data for the month. To check you have to click the widget > wait for it to load the personal data usage > click the account tab on the bottom > click usage. All this for something that should show on the widget in the first place. Also, the app basically being a shell for the webpage really shows when there are constant load times to navigate between each screen, and the complete lack of visual feedback for any interaction (click/touch) with the interface. Two stars are for the simple existence of a widget showing remaining data (PLZ add REMAINING DAYS!!!)",App improvements needed,General Feedback
4198806050,enz272,2025-06-18T06:20:38-07:00,5,21.0.0,Easy,Fluid site - thx 👍,Positive feedback,General Feedback
179593425,Khttvf,2025-08-26T16:27:36-07:00,5,21.2.1,Good,Gooddd,Positive feedback,General Feedback
179311457,khushbot,2025-08-26T14:29:39-07:00,1,21.2.1,Worst Interest!!,"This has been the WORST internet experience of my life. I was a Verizon customer for only about 5–6 months and in that short time, I ended up paying over $1,000 just for Wi-Fi. Every month the bill was outrageous, sometimes $100, sometimes $200, and even $300! That is INSANE for just internet.

When I first signed up, they promised me student discounts and also said my dad’s EBT would qualify for additional discounts. But once I became a member, they didn’t help me at all. I spent hours trying to apply those discounts myself, struggling to lower the bill, but Verizon gave me no support. Before I joined, they told me everything would be fine and they would help. But the moment I became a customer, they just ignored me and kept charging me ridiculous amounts.

I must say the internet speed is good, but paying this much for Wi-Fi is absolutely crazy. Spending $200–$300 a month only on internet is not acceptable when I have other bills to cover. Their customer service is useless, their promises are empty, and the bills are nothing but a trap.

I switched last month because I couldn’t take it anymore. I will NEVER recommend Verizon to anyone. Save yourself the frustration, stress, and money.",Negative experience; high cost,Account & Billing
179170168,AMichelle12,2025-08-26T13:33:19-07:00,1,21.2.1,Bad app,"I have been trying to update my app for two days to pay my bill, and it won’t do anything.",Cannot update app,technical/platform issues
177791401,Chess.com = trash,2025-08-26T06:08:12-07:00,1,21.2.1,Unusable trash. Hardly functional,There’s no way Verizon paid someone to develop this app. Awful user interface. The layout is a mess. Also this app has non stop bugs. This app is absolute trash and rarely actually just works.,"Negative feedback, app issues.",technical/platform issues
176619569,Futhat’sit,2025-08-25T22:34:32-07:00,1,21.2.1,Would be great if I didn’t need to change my password every time I use this app.,Read the title.,Password change frustration,Technical/platform issues
176304962,Perplexed630,2025-08-25T20:09:41-07:00,2,21.2.1,Notifications,"Every few months, I get a notification that I cannot turn off. Finally shut off all notifications.",Notifications are annoying.,General Feedback
175892283,g00g01p1ex,2025-08-25T17:19:15-07:00,3,21.2.1,Missing hotspot data usage for one device,"Within current billing cycle, both the Verizon iOS app and the website are missing the hotspot data usage for our iPad. The data usage shows for both our iPhones and for our iPad, but hotspot data usage only shows for our iPhones, but is missing for our iPad. Please fix. Issue is not specific to the app, as the website has the same issue.",Fix hotspot data,technical/platform issues
175496481,Kenips,2025-08-25T14:32:49-07:00,5,21.2.1,Outstanding Customer Service!!!!,"I visited your West Tropicana location last Saturday to pick up a new WiFi router. Joshua, & the other associate provided me with “Outstanding Customer Service!” I highly recommend this store & their service!!! Thank you so much; I appreciate you!!! 💯🙏🏾🫶🏾💎",Praise for service,Customer Support
175188641,Vinto410,2025-08-25T12:35:33-07:00,1,21.2.1,Terrible App,"Login is so flawed. Insists the answer to my secret question is wrong, it isn’t but I changed it. Again it told me it’s wrong. Insists my password is wrong. It isn’t. Have no idea if anything works because login is so flawed",Login issues,technical/platform issues
171816955,Этмун,2025-08-24T17:22:41-07:00,1,21.2.1,Dude,The worst internet ever,Negative internet experience,technical/platform issues
159012536,Anon7890,2025-08-21T09:40:17-07:00,4,21.1.1,App Notifications,"I only want account updates as notifications, start sending me all of your promotional offers since there's absolutely no reason for me to get an additional line, new phone, or Verizon credit card. The app also keeps the notification bubble there with no way to remove it after you read notifications.",Control app notifications,General Feedback
4174487097,pmym06,2025-06-11T21:37:24-07:00,5,21.0.0,Update your app!!!!!,I am putting 5 start not because it is great but in order for people to see this review! I have been trying to open my account for 3 hours and I am trying to get a copy of my bills for other purposes and IT IS ALWAYS REFRESHING AND NOTHING COMES OUT AFTER WAITING FOR A LONG TIME!!,Cannot access bills,Account & Billing
25290956,Sha-shee,2025-07-19T04:11:48-07:00,1,21.0.2,I hate Verizon,"If you want to spend the whole day trying to change your password Verizon is the place to go. IT’s impossible. You will get a live rep who will practically needs your DNA, your blood type and a pound of flesh before they can help you.Their Bot is ridiculous. It will ask you the same question over and over and over again..I really give it zero stars. This probably won’t get posted however I hope some literate Verizon employee will read it and actually at least show it to the big bucks ladies and gentlemen as they sit around the conference table drinking their Starbucks mocha lattes
and think, maybe we should look into this, 

P.S. those glowing comments they do post are FAKE!",Password change frustration,technical/platform issues
7217301,Sandwhichpants,2025-07-14T14:32:50-07:00,1,21.0.2,App doesn’t work,"I can’t even type anything if I try to make a 1-time payment, which is the only payment it will accept for my internet (which is also abysmal after 3 months of service, been trying to get that fixed for 3 years now). 
Phone service is also mediocre at best. Claims I get 5g EVERYWHERE, but I drop to SOS mode more now than I ever did on AT&T. I’m currently on regular LTE data because, despite paying for the top service available, Verizon cannot uphold their end of a deal. Honestly might switch everything to another company cuz I’m beginning to truly hate this one.",Switch to another company,Customer Support
92272928,Harrison Donner,2025-08-04T19:18:46-07:00,1,21.1.0,One of the worst I have used,"Slow! Online chat not working! Status of service incorrect - 12 hours after home internet service outage, this app still showed a normal service while my phone call to Verizon again confirmed the service outage would not recover 
until tomorrow early morning!","Negative feedback, app issues",technical/platform issues
91271824,KDBax,2025-08-04T12:54:22-07:00,3,21.1.0,Upfromtheashes66,"Where I live Verizon use to be (several years ago) the best cell reception you could get. So long ago the amount you would pay for their services was worth it. Now, especially the past few months, I don’t receive many calls, frequently get dropped calls and when I go to call someone many times I have to call two or three times for it to go through. What changed? This time that I am with Verizon I bought a phone on a payment plan… are my issues because they know I am locked in for another couple of years? Or has Verizon signals really dropped that low?
One of the perks for signing up for everything I did was free Disney+ for a year… well I dropped that… because I always had to sign in and verify it was me… it would say on my tv I was in different cities, some I had never even heard of (Assuming that was where my signal was coming from). Anyway Disney+ decided I had used up my loggings… on the same three tvs. So what’s the point in keeping something you can’t watch anyway. I know how much money I drop every month and it seems I should have much better service!",Complaining about service.,Customer Support
81774775,Bilbo3101,2025-08-02T04:30:04-07:00,1,21.0.2,Total chaos,"I don’t believe all the good reviews are real because this app is incredibly confusing and hard to do anything. 
The “perks” are all over the place and it’s easy to upgrade but very difficult to downgrade. 
Might be my least favorite app on my phone.",Expressing extreme dissatisfaction.,General Feedback
