id,author_name,last_updated,rating,version,title,content,intention,classified intention
15873258,sdwolverine,2025-07-16T19:02:30-07:00,1,21.0.2,Garbage,This app constantly gives me trouble. All this money for all these years and they just can’t get it right.,Expressing dissatisfaction,General Feedback
14936273,Jesterjessin,2025-07-16T13:00:51-07:00,1,21.0.2,Garbage,"For a multi million dollar company, you would expect that the billing part of the app would always be updated. But it takes 2 to 3 billing cycles to be updated to normal. What a joke, garbage app.",Billing app issues,Account & Billing
14773244,EGSweet,2025-07-16T12:05:38-07:00,5,21.0.2,Best company ever,"My husband and I love Verizon. We’ve been customers for over 20 years after trying several other providers.  No one’s been able to touch Verizon. Not only is their phone service great, but every person we’ve ever dealt with has been amazing and their loyalty program is excellent.","Highly satisfied, loyal customer",General Feedback
13856275,apjr81,2025-07-16T07:29:37-07:00,2,21.0.2,Needs improvement,The app is constantly freezing.,App freezing issues,technical/platform issues
13322070,Cam3333333,2025-07-16T04:51:43-07:00,1,21.0.2,Waste of customers’ time,App is so slow and laggy. Wasted so much time trying to make changes to my services via the app instead of calling customer support. The app is supposed to be the quicker alternative!!,App performance issues.,technical/platform issues
12643451,"Darius 057,,’",2025-07-16T00:27:47-07:00,4,21.0.2,"Fraud,apple devices,my version account,version cellular,and my app","I am unhappy with my version account.someone have connected other apple devices to my account with out my permission.know they are in my settings, and using my credit cards,my Apple Pay with out my permission. I need help right now.  I have been saying the same thing for year. Please block all other devices that’s linked to my version account, And my device please",Account security issue,Account & Billing
11777174,Remo108,2025-07-15T18:29:59-07:00,1,21.0.2,Annoying,Stop asking if I like the app,Wants no more prompts,General Feedback
11431844,2yrs customer,2025-07-15T16:11:46-07:00,1,21.0.2,Terrible,Terrible no us customer service live agents,No customer service,Customer Support
10326043,tlmorman,2025-07-15T09:41:44-07:00,1,21.0.2,The app is in Spanish,I have tried everything to get the app in English to no avail. Help!,Change app language,General Feedback
7914713,niborsnebula,2025-07-14T19:15:05-07:00,5,21.0.2,The app works well,The app is easy to navigate.,Positive app experience,General Feedback
7593857,$isyphus,2025-07-14T17:06:55-07:00,1,21.0.2,Please invest in a better app development team/vendor,"It is hilarious that an ISP/Smart Phone retailer made this app. Incredibly slow performance. Frequent formatting or typographic errors throughout. Wildly frustrating, glitchy, and outdated interface. This would be disappointing 8 years ago - there is no excuse to be this bad in 2025.",Wants app improvement.,General Feedback
7217301,Sandwhichpants,2025-07-14T14:32:50-07:00,1,21.0.2,App doesn’t work,"I can’t even type anything if I try to make a 1-time payment, which is the only payment it will accept for my internet (which is also abysmal after 3 months of service, been trying to get that fixed for 3 years now).
Phone service is also mediocre at best. Claims I get 5g EVERYWHERE, but I drop to SOS mode more now than I ever did on AT&T. I’m currently on regular LTE data because, despite paying for the top service available, Verizon cannot uphold their end of a deal. Honestly might switch everything to another company cuz I’m beginning to truly hate this one.",Switching providers,Account & Billing
5789001,Sissy070201,2025-07-14T06:49:56-07:00,1,21.0.2,Screens do not load,This app is horrible. Every time I try to look at my account it just says it’s loading the page and it never loads if I try to view my payment method or add a payment method it just says loading or I get HTML code across the top of the page.,App loading issues,technical/platform issues
4566042,nogi3000,2025-07-13T23:07:38-07:00,1,21.0.2,Can’t even log in,"“Unable to process your request” in the app, not able to login on a website because no verification has been sent. How can you have to users such a bad developed app?",Login/app issues,technical/platform issues
4538519,Monquie😘,2025-07-13T22:55:07-07:00,1,21.0.2,Horrible,Apps crashes & freezes badly. Doesn’t always load.  Only good if you want to pay your bills online without going to the store,"Negative experience, app issues.",technical/platform issues
4254011,D Ace 🖤,2025-07-13T20:45:40-07:00,5,21.0.2,Access to do everything,I love that I can come on the app and do anything regarding my cell service. Thanks Verizon.,Loves Verizon app,General Feedback
3655040,Monge12,2025-07-13T16:31:43-07:00,1,21.0.2,Terrible update;awful pricing,"Recent updates to the app have made it a worse user experience than the previous version. One used to find all the information needed in a single tab, now one must dig through multiple sub menus just to get the same information. I’m guessing they’ve never heard the phrase “if it ain’t broke, don’t fix it.” Additionally, Verizon has switched to a tier subscription-like model for their phone upgrades where you only get good upgrade promotions by paying for the top tier plan. This is very different compared to before. I will be looking to switch to a different carrier.",Switching carriers,Account & Billing
3607183,Verizon. employee,2025-07-13T16:10:42-07:00,1,21.0.2,Very poor service,"Very poor service, especially for issues created by Verizon, I had to spent hours chasing their agents",Customer dissatisfaction with service,Customer Support
3480280,Andrew 3.21,2025-07-13T15:16:11-07:00,5,21.0.2,Customer service,Verizon customer service is the best in the world and the My Verizon app is amazing. Thank you again.,"Positive feedback, appreciation.",General Feedback
3476063,PortPort,2025-07-13T15:14:22-07:00,1,21.0.2,"Terrible company, terrible app",You click the customer service options and no one ever comes on.,Complain about service,Customer Support
3321989,sarahvh04,2025-07-13T14:11:20-07:00,1,21.0.2,Won’t even let me log in,"I went into the store in my town to get a new router. Opened a new account and everything and was told to download this app and I can’t even login, because the phone number it is sending the verification code to is the Wifi’s number. Last time I checked it cannot get a verification code. Went back to the store and they tried to help but to no success. Called the mobile line and it’s all AI and thought I was trying to change my phone number. Why have me download the app if I can’t even login to it?",Cannot log in,technical/platform issues
3155398,JW39999,2025-07-13T13:09:35-07:00,1,21.0.2,Impossible to use,"This app is so slow, it will not allow you to add / change any services and constantly logs you out, almost impossible to navigate",Negative feedback.,General Feedback
1802760,eiscremegod,2025-07-13T06:05:02-07:00,5,21.0.2,I Love My Verizon,Been with Verizon for over 15+ years now. I love all their services and products. Excellent customer service care and support.,Positive customer experience,General Feedback
788142,Ricky Valentyne,2025-07-12T23:31:37-07:00,1,21.0.2,Rage Bait App,"Everytime I sign in on the app theres a weird problem, bit this time it was the last straw. I went to sign in to my account and out of nowhere they asked me to verify my account by entering a code with some random number i've never seen before. I tried to get a hold of someone but it kept saying sign in and verify through phone number. I had to go to the website and pay off my bill. Delete the app and just use the website its just better with little to no problems.",App verification issues,technical/platform issues
700351,Jest CXVII,2025-07-12T22:52:40-07:00,1,21.0.2,"Awful support, delivered with a terrible app. 5 stars for this app is a joke.","Chat is worthless when the app works, app often crashes when trying to get to the login page. Can’t get much worse.",Negative feedback.,General Feedback
4293933288,TheDistinze,2025-07-12T10:58:28-07:00,1,21.0.2,Bad App Bad Website,Cannot look at community forums since it won’t let me open any of them or review comments on issues I’m having. Website login just goes into a login and “verify it’s you” loop. Pretty tired of Verizon and its poor cellular service and network.,App/website issues.,technical/platform issues
4293695787,Crashing Every Time I play,2025-07-12T09:40:38-07:00,5,21.0.2,My Verizon,I Like This App Because I Can Look At My Bill And To See When I Can Up Grade I Like The Verizon App I Can Look At My Date And I Can shop for me to see what kind of phone I want When I upgrade thank you my Verizon app yall do A great job to Help people,"Positive feedback, app functionality.",General Feedback
4293409639,The Internet is Dead,2025-07-12T08:13:50-07:00,1,21.0.2,Not for completionists,Hope you like random notifications for things you can’t find and won’t go away!,Frustrated by notifications,General Feedback
4293364210,BigWillieZteve,2025-07-12T08:00:39-07:00,2,21.0.2,Buyer Beware,"I have been a customer of Verizon for over 7 years. Have had the highest paid plan, fallen victim to the newest phone and upgrade, and dealt with this terrible app and chat feature an immeasurable amount of times.

I recently switched to Mint because it’s way cheaper (for the price of 1 month at Verizon , I can get 3 months at Mint for 2 people) and the connection has been identical. I kept the 5G internet because it works and it’s a good deal.

Since the switch, I have been faced with nothing but the most vindictive user experience. I lost access to my app account (which is how I pay my bill), I have now been inundated with warnings surrounding getting with the support team to troubleshoot my 5G connectivity. I’m no fool. They’ve been throttling my connection since I’ve switched carriers and I’ll call it like it is. It’s dishonest, petty, vindictive, and not a way a business should be practicing.

I’ve always said if you take care of your people, they will take care of you. Verizon will take your money, offer you discounts that are just what you would have paid had you not switched to the “newest” plan, and leave you on read when you are trying to do it their way.

You’ve been warned.",Warning about Verizon,General Feedback
4291223922,Reviewer3859,2025-07-11T18:15:26-07:00,1,21.0.2,Garbage,Being able to get logged in would be a good start....,Login issues,technical/platform issues
4291029418,Nacket,2025-07-11T16:55:00-07:00,1,21.0.2,Can’t turn off promotional notifications,"I get frequent promotional notifications about device offers, apps I should use, music I should listen to, etc. from this app and I can’t turn them off. Sure, I could turn off all notifications, but then I’d miss bill notices, which I want to get. Section 4.5.4 of the App Review Guidelines requires Verizon to provide a way to turn off promotional notifications, but there is simply no such way. On the Verizon website, not the app, there is a settings page for adjusting mobile notifications, but there is no promotional notification setting. Please address this, as it violates the App Store rules.",Turn off promotions,General Feedback
4291006052,LaoOfTheRice,2025-07-11T16:45:00-07:00,4,21.0.2,It’s a must,No really download it,Strong recommendation to download.,General Feedback
4290940602,Dash Pick,2025-07-11T16:17:00-07:00,1,21.0.2,Used to work well,"Verizon was always 1st in customer service: now? Every element hangs, stops working from FIOS to their app, and there is no chance of talking to customer service. If anyone has gotten past the bots (which do nothing), let me know.",Customer frustration with service,Customer Support
4290924424,Shaywatson12345@1,2025-07-11T16:10:07-07:00,5,21.0.2,Shannon is amazing!,Shannon was excellent to  work with!  Very professional and explained all of our options. Highly recommend this location and Shannon.,Highly recommends Shannon.,Customer Support
4290432197,Maxwellsmart2,2025-07-11T12:53:37-07:00,2,21.0.2,Does not load,"This app is horrible will not load just sits there flashing, why did you have to break something that was working",App not working,technical/platform issues
4290057093,DeeMoneytalkz,2025-07-11T10:41:47-07:00,5,21.0.2,Best Company,I love shopping with Verizon! They’re helpful and great customer service!!!,Positive customer experience,General Feedback
4289032310,mthrtruckr1,2025-07-11T05:35:16-07:00,3,21.0.2,Challenge to register,"Sent in loops to register. Answer to secret question had spaces which weren’t allowed during verification, nightmare. The. account number not emailed in Verizon correspondence so one time payment without logging in wasn’t possible.  30 minutes waiting for live agent. Today I finally got a live agent who assisted me wonderfully. Please add more live agents. Ann was way more helpful than any chat bot or recording can be.",Troublesome registration process.,technical/platform issues
4288934312,Lo____Lo,2025-07-11T05:03:52-07:00,1,21.0.2,Me page continually loads,Can’t pay bill via Me page. Just continually loads . Thanks Verizon …………………..,Cannot pay bill,Account & Billing
4287950128,Tehun,2025-07-10T22:27:20-07:00,1,21.0.2,So many bugs,"This is one of the worst tech apps I’ve ever used… and it’s from a huge tech company! Connectivity is spotty at best, I can’t watch any of my DVR content on a mobile device without being on my home WiFi. The entire login keeps collapsing without notice. The mobile remote control is a joke. Verizon should be ashamed",Negative feedback/complaint,General Feedback
4286923402,_nomadico,2025-07-10T15:23:46-07:00,1,21.0.2,Trash,The app does not work!!,App not working,technical/platform issues
4286570009,Carolmarie10,2025-07-10T13:09:15-07:00,5,21.0.2,Amazing,This is the first time I’ve ever been able to make changes to my account via online or app.  So great!,"Positive, account access",Account & Billing
4285785942,seattllee,2025-07-10T08:53:03-07:00,1,21.0.2,Verizon is a terrible provider.,Last year I had to freeze my account going overseas and they attempted to charge me international fees multiple times even know they knew about my situation. I had to call them 6 different times to re freeze my account and now they’re attempting to smear my credit by sending those false charges to collections. Terrible company.,Negative experience/Complaint,Customer Support
4285699098,evilpettingzoo27,2025-07-10T08:27:40-07:00,1,21.0.2,Slow and Bloated,"Remarkable for a communications company how difficult Verizon makes it to find any useful information about my accounts. Pertinent account information is shifted nearly monthly. And this whole thing is a giant sales app. I understand they want me to purchase new products and services, but it’s nearly impossible to access the services and features that I do have.",Frustrated with app.,technical/platform issues
4285636561,Michael Blah,2025-07-10T08:09:48-07:00,1,21.0.2,Upgrade annoyance,"After receiving a notification on my Verizon app. I cannot figure out how to clear it in the app. Persistent notifications on my home screen annoy me. This is going to prompt me to remove the Verizon app from my phone. Having those red numbers hovering over the app is beneficial to alert the user, but should be easy to acknowledge",Clear notification annoyance,General Feedback
4285375956,Pavan Katukala,2025-07-10T06:55:39-07:00,1,21.0.2,Worst network ever,"I have paid off my phone but to unlock the carrier lock sim lock it is 8 days, and when I called customer service they are very rude no help bad network I post this on every social media",Unlocking carrier lock,Customer Support
4285235159,BUCWILE,2025-07-10T06:14:50-07:00,1,21.0.2,Terrible service,"3 days to receive emails, dropped calls, and zero reception, no matter how much money i spend, Plymouth Wisconsin has zero reception. I have to pay for two cellphones to operate my business so i can get reception in Plymouth Wi. Terrible reception $240 to use my apps so i can make $12 an hour!",Customer intention: Poor reception,Technical/platform issues
4285140420,Flacox171,2025-07-10T05:46:20-07:00,5,21.0.2,New Update,"With the new update the layout is user friendly, extremely helpful and much more efficient than it was before.",Positive update feedback,General Feedback
4284782619,RG Harley,2025-07-10T03:47:26-07:00,1,21.0.2,Admin,Not user friendly when you are traveling outside of the states.,Negative travel experience.,General Feedback
4284670167,bunnieboi,2025-07-10T03:04:44-07:00,5,21.0.2,Best company,9 years strong with great connection,"Positive, long-term experience",General Feedback
4283886294,Da'Greatest PERIOD,2025-07-09T21:36:11-07:00,5,21.0.2,The Best,I am grateful for Verizon,Expresses gratitude,General Feedback
78982492,BK8815,2025-08-01T10:32:01-07:00,4,21.0.2,Not the best but okay,Just can be very slow loading the app,App loading slow,technical/platform issues
78943250,BrianOx,2025-08-01T10:20:04-07:00,1,21.0.2,Terrible security,Mobile passwords reset loop when trying to make payment is infuriating. Quit making it hard for people to give you money,Wants easier payment,Account & Billing
78887968,D. Madge,2025-08-01T10:03:27-07:00,1,21.0.2,Glitchy app,"App always glitches out the local password rewards are a joke. You can virtually never claim one. We’ve tried for several years and only gotten one used to get monthly rewards now they are rarely on there at all. Plus, it’s a joke trying to get a hold of customer service. Verizon has gone downhill so much. It’s not even funny. I’ve been thinking about leaving the company since they just keep raising prices and keep giving you horrible service and customer service .",Negative experience; leaving.,Customer Support
78502381,Alfaro’s Vineyards,2025-08-01T08:13:33-07:00,5,21.0.2,Best Service Ever,App is so easy to use and very helpful. Self explanatory and straightforward. Thank you Verizon!,Appreciation for service,Customer Support
76697356,DJShmruda,2025-07-31T21:59:54-07:00,5,21.0.2,Great,Great,Positive experience,General Feedback
76448650,SamNY101,2025-07-31T20:18:32-07:00,1,21.0.2,Slow Buggy App,"You'd expect Verizon to have a solid loading speed in app, but no it's the buggiest app I'm ever needing to use. Phone and app on updated version. But Verizon will always take 10-15 times longer to load. Unreal.",Complaining about app performance,technical/platform issues
76424230,IfYuKnow,2025-07-31T20:09:02-07:00,1,21.0.2,Verizon is the worst,Zero customer support. Their chat service doesn’t work. Cancelling my services after 20 years as a customer.,Cancelling services,Customer Support
76331478,Jbeezi93,2025-07-31T19:33:23-07:00,1,21.0.2,Slow app,Too slow. Very frustrating,Expressing app frustration,Technical/platform issues
76204155,Longtime(now frustrated) User,2025-07-31T18:45:57-07:00,1,21.0.2,Too many bugs,"What’s changed to the app to make it so glitchy? I’ve never experienced the issues I’ve been experiencing lately. Too many bugs, loops, roadblocks and dead links. It’s also constantly spinning and crashing. Something needs to change!",Needs app fixes,technical/platform issues
76125204,New App User17,2025-07-31T18:16:16-07:00,1,21.0.2,Endless loop,"Cannot access the My Verizon app. When I try to log on, it pops up my initial online order, with a message that says that I will be able to access the app, once the “owner’s” phone is activated. The “owner’s” phone was activated 2 weeks ago. Seems like the app is designed to sell you more stuff rather than assist you with your account.",App access issues,technical/platform issues
75895566,CookieMonster3301,2025-07-31T16:47:56-07:00,1,21.0.2,Phone Support,"Fix your phone support, why does it take 2 hours to activate internet. They need to get rid of their AI completely and stop relying on phone support to activate devices. Why can’t I just do it on my own so I don’t have to deal with this circus of a system???",Needs faster activation.,Customer Support
75508865,String Ring,2025-07-31T14:18:10-07:00,5,21.0.2,Usually easy,"I didn't have any problem changing my plan and adding perks. I have had varied results with the chat, but those results were because of the representative. I haven't been to a Verizon store in years because I've been able to do everything with the app. It's great being able to take my time to make decisions instead of listening to a representative.",Positive experience with app,General Feedback
75061216,laurenmarie05,2025-07-31T11:44:02-07:00,1,21.0.2,Wish it would work!,"For whatever reason, it stopped working a month ago. Now it just says “Unable to process your request” every time I try and open it.","Disappointed, not working.",technical/platform issues
72287795,Marthanna,2025-07-30T20:15:18-07:00,5,21.0.2,Great app!   Love Verizon.,"I just upgraded my phone today and totally happy with how easy it was… I’m not a paid shill, but I have to say I never have problems with Verizon.   Solid service and the app is easy to use - recent update has made it even better.","Positive experience, satisfied.",General Feedback
71222813,jlcorn,2025-07-30T13:33:12-07:00,5,21.0.2,Easy!,"We currently found it so much quicker and easier to use the Verizon app online, rather than try to deal in person with the people at our Verizon dealer store. We don’t have an actual Verizon store in Park City, Utah and the folks at the Verizon dealer store are mean and nasty young kids! We spent several hours trying to get a new phone this morning and we’re quoted almost $40 a month more , than the Verizon app came up with! So the Verizon app is definitely the way to go!",App experience preferred,General Feedback
71129859,Louie the Frenchie,2025-07-30T13:00:51-07:00,5,21.0.2,Verizon makes it Easy,I was able to order service for my IPad so easily online through my Verizon account app. No hassle of running all the way to the city store. Love this app.,"Positive experience, easy.",General Feedback
70863270,cowbkh,2025-07-30T11:32:25-07:00,1,21.0.2,This app needs a remodel.,They give you the bare bum minimum information on their app. Pretty buggy and minimal tools to review your plans.,Needs app improvement,Technical/platform issues
70422701,PORT3RMAN,2025-07-30T09:19:22-07:00,1,21.0.2,THE WORST!,"AS SOON AS MY DEVICES ARE PAID-OFF, I AM OUT!",Canceling service soon.,Customer Support
67452770,66 dude,2025-07-29T16:01:47-07:00,1,21.0.2,Difficult to login and pay bill,"The mobile application does not have MFA and it is very difficult to login. It gives you too many options to login with account number and ZIP Code with other options as well and it’s just very confusing and a very poor user experience.
I should be able to open the app go right to a billing feature. Pay my bill and be done with it. That’s three steps maybe four if  you count being done with it.","Simplify login, pay bill",Account & Billing
67159809,Fbwifhrbdifjwnskfb,2025-07-29T14:08:50-07:00,1,21.0.2,Glitchy,App is super glitchy and will not allow me to complete an order.,Cannot complete order,technical/platform issues
67125136,BQuinn99,2025-07-29T13:56:01-07:00,1,21.0.2,Service has gone down the drain ..,"I’ve been with Verizon for years. Service has gone seriously downhill, while we all pay a premium rate for AI chat bots to misunderstand everything you needed, then refuse to let you sign in as it sends text “verifications” to some other number that isn’t even on the account. Any guesses how well that works out? Time to get to shopping for better service.",Switching providers.,Account & Billing
67123736,Rickii 1,2025-07-29T13:55:29-07:00,5,21.0.2,Rico,Love their customer service. One of the best so far.,Praising customer service.,Customer Support
66674430,ZbReview,2025-07-29T11:22:46-07:00,1,21.0.2,So Buggy,"Buggy, inconsistent, unresponsive, minimalistic but in the annoying way that makes it just super useless. Consistently shows a blank page when it loads. I have to click on “more” and then “account”. Hard to find anything. Not to the standard a major teleCOMMUNICATIONs company should have.",Negative app experience,technical/platform issues
66018859,snotlarc,2025-07-29T08:08:00-07:00,1,21.0.2,All these fake reviews,"Chat half way works, then times out rep on other end takes 3-5 minutes to reply back I really believe the rep I stated to chat fell asleep, then time out, next up schedule a simple call back , yea right enter your phone number, reason,then click confirm , message failed, next up chat was me to download messenger yea right, I don’t due the web like that . Looking for another internet provider.",Switch internet provider.,Customer Support
63688928,Resses49,2025-07-28T17:50:21-07:00,5,21.0.2,Verizon,I Love this Company The Service is awesome and great,Positive customer experience,General Feedback
63530706,Vincent Jenks,2025-07-28T16:46:53-07:00,1,21.0.2,Useless Junk,"The most frustrating, buggy, infuriating trash I’ve ever used. All I wanted to do was pay off a device, but it’s completely broken. Terrible UI and experience.","Negative feedback, broken app.",technical/platform issues
62899571,Dugan211,2025-07-28T12:46:48-07:00,1,21.0.2,Dugan,Your service is horrible in Mississippi. Even T-Mobile kick your butt that’s a shame. I mean that’s just plain sorry.,Expressing service dissatisfaction,Customer Support
